<?xml version="1.1" encoding="UTF-8" ?>

<kenken filas="6"
xmlns="http://agora.unileon.es"
xmlns:xsi="http://www.w3.org/2001/XMLSchema-instance"
xsi:schemaLocation="http://agora.unileon.es kenkenSchema.xsd">

  <fila numero="1">
    <casilla numero="1" norte="true" este="true" sur="false" oeste="true">
      <operacion>11+</operacion>
      <solucion>5</solucion>
    </casilla>
    <casilla numero="2" norte="true" este="false" sur="true" oeste="true">
      <operacion>2รท</operacion>
      <solucion>6</solucion>
    </casilla>
    <casilla numero="3" norte="true" este="true" sur="true" oeste="false">
            <solucion>3</solucion>
    </casilla>
    <casilla numero="4" norte="true" este="true" sur="false" oeste="true">
      <operacion>20x</operacion>
      <solucion>4</solucion>
    </casilla>
    <casilla numero="5" norte="true" este="false" sur="true" oeste="true">
      <operacion>6x</operacion>
      <solucion>1</solucion>
    </casilla>
    <casilla numero="6" norte="true" este="true" sur="false" oeste="false">
            <solucion>2</solucion>
    </casilla>
  </fila>

  <fila numero="2">
    <casilla numero="1" norte="false" este="true" sur="true" oeste="true">
            <solucion>6</solucion>
    </casilla>
    <casilla numero="2" norte="true" este="false" sur="true" oeste="true">
      <operacion>3-</operacion>
      <solucion>1</solucion>
    </casilla>
    <casilla numero="3" norte="true" este="true" sur="true" oeste="false">
            <solucion>4</solucion>
    </casilla>
    <casilla numero="4" norte="false" este="true" sur="true" oeste="true">
            <solucion>5</solucion>
    </casilla>
    <casilla numero="5" norte="true" este="true" sur="false" oeste="true">
      <operacion>3รท</operacion>
      <solucion>2</solucion>
    </casilla>
    <casilla numero="6" norte="false" este="true" sur="false" oeste="true">
            <solucion>3</solucion>
    </casilla>
  </fila>

    <fila numero="3">
    <casilla numero="1" norte="true" este="false" sur="false" oeste="true">
      <operacion>240x</operacion>
      <solucion>4</solucion>
    </casilla>
    <casilla numero="2" norte="true" este="true" sur="false" oeste="false">
            <solucion>5</solucion>
    </casilla>
    <casilla numero="3" norte="true" este="false" sur="true" oeste="true">
      <operacion>6x</operacion>
      <solucion>2</solucion>
    </casilla>
    <casilla numero="4" norte="true" este="true" sur="true" oeste="false">
            <solucion>3</solucion>
    </casilla>
    <casilla numero="5" norte="false" este="true" sur="true" oeste="true">
            <solucion>6</solucion>
    </casilla>
    <casilla numero="6" norte="false" este="true" sur="true" oeste="true">
                  <solucion>1</solucion>
    </casilla>
  </fila>

  <fila numero="4">
    <casilla numero="1" norte="false" este="false" sur="true" oeste="true">
            <solucion>3</solucion>
    </casilla>
    <casilla numero="2" norte="false" este="true" sur="true" oeste="false">
            <solucion>4</solucion>
    </casilla>
    <casilla numero="3" norte="true" este="true" sur="false" oeste="true">
      <operacion>6x</operacion>
      <solucion>1</solucion>
    </casilla>
    <casilla numero="4" norte="true" este="true" sur="false" oeste="true">
      <operacion>7+</operacion>
            <solucion>2</solucion>
    </casilla>
    <casilla numero="5" norte="true" este="false" sur="true" oeste="true">
      <operacion>30x</operacion>
      <solucion>5</solucion>
    </casilla>
    <casilla numero="6" norte="true" este="true" sur="true" oeste="false">
            <solucion>6</solucion>
    </casilla>
  </fila>

   <fila numero="5">
    <casilla numero="1" norte="true" este="false" sur="true" oeste="true">
      <operacion>6x</operacion>
      <solucion>2</solucion>
    </casilla>
    <casilla numero="2" norte="true" este="true" sur="true" oeste="false">
            <solucion>3</solucion>
    </casilla>
    <casilla numero="3" norte="false" este="true" sur="true" oeste="true">
            <solucion>6</solucion>
    </casilla>
    <casilla numero="4" norte="false" este="false" sur="true" oeste="true">
            <solucion>1</solucion>
    </casilla>
    <casilla numero="5" norte="true" este="true" sur="true" oeste="false">
            <solucion>4</solucion>
    </casilla>
    <casilla numero="6" norte="true" este="true" sur="false" oeste="true">
      <operacion>9+</operacion>
                  <solucion>5</solucion>
    </casilla>
</fila>

<fila numero="6">
    <casilla numero="1" norte="true" este="false" sur="true" oeste="true">
      <operacion>8+</operacion>
                  <solucion>1</solucion>
    </casilla>
    <casilla numero="2" norte="true" este="false" sur="true" oeste="false">
            <solucion>2</solucion>
    </casilla>
    <casilla numero="3" norte="true" este="true" sur="true" oeste="false">
            <solucion>5</solucion>
    </casilla>
    <casilla numero="4" norte="true" este="false" sur="true" oeste="true">
      <operacion>2รท</operacion>
      <solucion>6</solucion>
    </casilla>
    <casilla numero="5" norte="true" este="true" sur="true" oeste="false">
            <solucion>3</solucion>
    </casilla>
    <casilla numero="6" norte="false" este="true" sur="true" oeste="true">
            <solucion>4</solucion>
    </casilla>
</fila>

</kenken>
